{
  "$schema": "http://json-schema.org/draft-07/schema#",
  "$id": "https://reconnect.org/gamespace/protocol.schema.json",
  "title": "Protocol",
  "description": "Сценарий эксперимента: что запускается, с какой сложностью и чем заканчивается. Приложение не содержит расписания, оно исполняет этот документ.",
  "type": "object",
  "additionalProperties": false,
  "required": ["protocolVersion", "id", "title", "sections"],
  "properties": {
    "protocolVersion": { "type": "string", "pattern": "^\\d+\\.\\d+$" },
    "id": { "type": "string", "pattern": "^[a-z0-9._-]+$" },
    "title": { "type": "string" },
    "seed": { "type": "integer", "description": "Общий seed сессии; при отсутствии выводится из participantId" },
    "locale": { "type": "string" },
    "difficulty": { "$ref": "#/definitions/difficulty" },
    "interaction": {
      "type": "object",
      "additionalProperties": false,
      "description": "Чем участник отвечает во всём протоколе. Ёмкость ответа — свойство стенда, а не модуля: из неё выводится и раздача клавиш, и предел по оси числа вариантов",
      "properties": {
        "keys": {
          "type": "array",
          "minItems": 1,
          "items": { "type": "string", "minLength": 1 },
          "description": "Клавиши ответа слева направо; при отсутствии действуют привязки из манифестов"
        },
        "pointer": {
          "type": "string",
          "enum": ["free", "task-only"],
          "description": "task-only оставляет мышь только там, где указание — существо задачи (зрительный поиск)"
        }
      }
    },
    "counterbalance": {
      "type": "object",
      "additionalProperties": false,
      "required": ["swap"],
      "description": "Порядок двух участков назначается воспроизводимо по participantId, а не заново рандомизируется",
      "properties": {
        "swap": {
          "type": "array",
          "minItems": 2,
          "maxItems": 2,
          "items": { "type": "string" },
          "description": "Идентификаторы участков, которые меняются местами у половины участников"
        },
        "pause": { "$ref": "#/definitions/screen" }
      }
    },
    "interstitials": {
      "type": "object",
      "additionalProperties": false,
      "description": "Экраны сессии в целом. Тексты живут в документе протокола, а не в коде: их правит тот, кто ведёт эксперимент",
      "properties": {
        "intro": { "$ref": "#/definitions/screen" },
        "outro": { "$ref": "#/definitions/screen" }
      }
    },
    "overrides": {
      "type": "object",
      "description": "Закрепления на весь протокол по идентификатору модуля, в том числе для дочерних задач составных игр. Участок вправе их переопределить",
      "additionalProperties": {
        "type": "object",
        "additionalProperties": { "type": ["number", "string", "boolean"] }
      }
    },
    "bounds": {
      "type": "object",
      "description": "Границы значений на весь протокол по идентификатору модуля. Участок вправе их сузить или расширить",
      "additionalProperties": { "$ref": "#/definitions/gameBounds" }
    },
    "sections": { "type": "array", "minItems": 1, "items": { "$ref": "#/definitions/section" } }
  },
  "definitions": {
    "gameBounds": {
      "type": "object",
      "description": "Диапазон, внутри которого политике разрешено двигать ось. Совпавшие границы означают закреплённую ось: расти по ней некуда, и рост уходит на свободные оси",
      "additionalProperties": {
        "type": "object",
        "additionalProperties": false,
        "properties": {
          "min": { "type": "number" },
          "max": { "type": "number" }
        }
      }
    },
    "screen": {
      "type": "object",
      "additionalProperties": false,
      "required": ["title", "body"],
      "description": "Отбивка: экран между блоками — что кончилось, что начинается, сколько займёт, как себя вести. Листает оператор, а не участник: случайное нажатие не должно проматывать инструкцию. Пауза контрбалансированной пары привязана к позиции, а не к участку, потому что какой из двух блоков идёт вторым, решает жребий по участнику",
      "properties": {
        "title": { "type": "string" },
        "body": { "type": "array", "minItems": 1, "items": { "type": "string" } },
        "footer": { "type": "string", "description": "Строка про то, кто продолжает; по умолчанию про оператора" }
      }
    },
    "difficulty": {
      "type": "object",
      "additionalProperties": false,
      "required": ["policy"],
      "properties": {
        "policy": { "type": "string", "enum": ["monotonic", "adaptive", "manual", "fixed"] },
        "start": {
          "type": "integer",
          "minimum": 0,
          "description": "Нулевой уровень законен и означает обучающий: он объявлен в таблицах пресетов как шаг назад от первого"
        },
        "min": { "type": "integer", "minimum": 0 },
        "max": { "type": "integer", "minimum": 1 },
        "successesToAdvance": { "type": "integer", "minimum": 1 }
      }
    },
    "section": {
      "type": "object",
      "additionalProperties": false,
      "required": ["id", "games", "end"],
      "properties": {
        "id": { "type": "string", "pattern": "^[a-z0-9._-]+$" },
        "games": {
          "type": "array",
          "minItems": 1,
          "items": { "type": "string" },
          "description": "Одна игра или ротация: прогоны идут по кругу, пока участок не закончится"
        },
        "end": { "$ref": "#/definitions/termination" },
        "repeat": {
          "type": "boolean",
          "description": "Повторять прогоны, пока участок не кончился. Ложь означает один проход по объявленным модулям: блок закрывается вместе с ними, даже если по расписанию время ещё осталось. Так задаётся всё, что сам себе отмеряет длительность — иначе пауза на десять секунд внутри тридцатисекундного участка проходит трижды и перестаёт быть паузой на десять секунд"
        },
        "interstitial": { "$ref": "#/definitions/screen" },
        "training": { "type": "boolean" },
        "difficulty": { "$ref": "#/definitions/difficulty" },
        "overrides": {
          "type": "object",
          "description": "Параметры поверх выданных политикой, по идентификатору игры",
          "additionalProperties": {
            "type": "object",
            "additionalProperties": { "type": ["number", "string", "boolean"] }
          }
        },
        "bounds": {
          "type": "object",
          "description": "Границы значений на этом участке, по идентификатору игры",
          "additionalProperties": { "$ref": "#/definitions/gameBounds" }
        }
      }
    },
    "termination": {
      "oneOf": [
        {
          "type": "object",
          "additionalProperties": false,
          "required": ["by", "ms"],
          "properties": { "by": { "const": "time" }, "ms": { "type": "integer", "minimum": 1000 } }
        },
        {
          "type": "object",
          "additionalProperties": false,
          "required": ["by", "count"],
          "properties": { "by": { "const": "runs" }, "count": { "type": "integer", "minimum": 1 } }
        },
        {
          "type": "object",
          "additionalProperties": false,
          "required": ["by"],
          "description": "Участок по покрытию: кончается, когда каждая объявленная задача прошла критерий допуска из своего манифеста или исчерпала попытки. Так задаётся обучение — задача предъявляется потому, что она в списке, а не потому, что до неё дошла очередь",
          "properties": { "by": { "const": "coverage" } }
        },
        {
          "type": "object",
          "additionalProperties": false,
          "required": ["by", "ms"],
          "description": "Ограничение на длину одного прогона, а не всего участка",
          "properties": { "by": { "const": "run-limit" }, "ms": { "type": "integer", "minimum": 1000 } }
        },
        {
          "type": "object",
          "additionalProperties": false,
          "required": ["by", "of"],
          "properties": {
            "by": { "const": "first" },
            "of": { "type": "array", "minItems": 2, "items": { "$ref": "#/definitions/termination" } }
          }
        }
      ]
    }
  }
}
