{
  "protocolVersion": "1.0",
  "id": "reconnect-pilot",
  "title": "Пилот: нагрузка, колебания продуктивности, утомление",
  "locale": "ru",
  "difficulty": {
    "policy": "monotonic",
    "start": 1,
    "successesToAdvance": 2
  },
  "interaction": {
    "keys": [
      "Q",
      "W",
      "E"
    ],
    "pointer": "task-only"
  },
  "overrides": {
    "org.reconnect.stroop": {
      "colorCount": 3
    },
    "org.reconnect.arithmetic": {
      "optionCount": 3
    }
  },
  "counterbalance": {
    "swap": [
      "battery",
      "interrupt"
    ],
    "pause": {
      "title": "Короткая пауза",
      "body": [
        "Первый блок закончен. Можно расслабить глаза, размять руку и спросить всё, что хотите, — сейчас говорить можно.",
        "Со стула лучше не вставать и шапку не трогать: датчики стоят как надо, и их положение нам нужно сохранить до конца.",
        "Следующий блок такой же длины, но с другой работой — описание будет на следующем экране."
      ],
      "footer": "Оператор продолжит, когда вы будете готовы."
    }
  },
  "sections": [
    {
      "id": "baseline-pre",
      "games": [
        "org.reconnect.baseline"
      ],
      "end": {
        "by": "time",
        "ms": 600000
      },
      "interstitial": {
        "title": "Покой, 10 минут",
        "body": [
          "Заданий не будет. На экране появится крестик в центре — смотрите на него и просто сидите спокойно. Ничего решать, считать и запоминать не нужно.",
          "Постарайтесь не засыпать и не уходить в мысли о делах: пусть голова будет пустой, насколько это получается. Дышите как обычно, глаза держите открытыми.",
          "Десять минут — это долго. Это нормально, так и задумано: нам нужна ваша спокойная запись для сравнения."
        ],
        "footer": "Оператор начнёт, когда вы будете готовы."
      },
      "overrides": {
        "org.reconnect.baseline": {
          "durationMs": 600000,
          "showTimer": false,
          "text": "Сидите спокойно, смотрите в центр экрана. Ничего делать не нужно."
        }
      }
    },
    {
      "id": "training",
      "games": [
        "org.reconnect.arithmetic",
        "org.reconnect.n-back",
        "org.reconnect.stroop",
        "org.reconnect.rule-switch",
        "org.reconnect.dual-load",
        "org.reconnect.number-sequence"
      ],
      "training": true,
      "difficulty": {
        "policy": "fixed",
        "start": 0
      },
      "end": {
        "by": "first",
        "of": [
          {
            "by": "coverage"
          },
          {
            "by": "time",
            "ms": 600000
          },
          {
            "by": "run-limit",
            "ms": 180000
          }
        ]
      },
      "interstitial": {
        "title": "Обучение, около 10 минут",
        "body": [
          "Сейчас вы по очереди познакомитесь со всеми заданиями сессии. Перед каждым будет правило, пример и раскладка клавиш, а во время тренировки — подсказки: где вы ответили верно, а где нет и почему.",
          "Это единственная часть, где ошибаться полезно: тренировка на то и нужна, чтобы разобраться. Трудность здесь минимальная, спешить незачем.",
          "Если правило непонятно — скажите, мы повторим тренировку задания. Идти дальше с непонятым правилом смысла нет."
        ],
        "footer": "Оператор начнёт, когда вы будете готовы."
      }
    },
    {
      "id": "battery",
      "games": [
        "org.reconnect.adaptive-battery"
      ],
      "overrides": {
        "org.reconnect.adaptive-battery": {
          "blocks": 5,
          "switchEveryMs": 30000
        }
      },
      "end": {
        "by": "time",
        "ms": 2400000
      },
      "interstitial": {
        "title": "Чередование заданий, 40 минут",
        "body": [
          "Знакомые вам задания будут идти подряд, сменяя друг друга. Смена происходит сама, никаких действий для перехода не нужно — просто отвечайте на то, что видите на экране.",
          "Отвечайте как можно быстрее, но не в ущерб точности. Задания будут постепенно становиться труднее — так задумано, и до предела своих сил дойдут все. Ошибки будут, пропуски тоже; это часть работы, а не ваш промах.",
          "Подсказка о текущем задании всё время висит над содержанием — если потеряли нить, взгляните на неё и продолжайте с того стимула, который на экране сейчас.",
          "Сорок минут без перерыва. Устать за это время — ожидаемо; именно усталость нас и интересует, поэтому не старайтесь её скрыть и не бросайте работу.",
          "Во время блока не разговаривайте и не меняйте посадку. Если случится что-то серьёзное — руку вверх, мы остановим."
        ],
        "footer": "Оператор начнёт, когда вы будете готовы."
      }
    },
    {
      "id": "interrupt",
      "games": [
        "org.reconnect.interrupt-resume"
      ],
      "end": {
        "by": "time",
        "ms": 2400000
      },
      "interstitial": {
        "title": "Работа с прерываниями, 40 минут",
        "body": [
          "Основное задание здесь одно и идёт всё время: вы ищете числа по порядку на поле. Иногда работу прерывает другое задание — оно появляется сразу, без предупреждения, и его нужно выполнить.",
          "Резкость перехода здесь намеренная. Когда прерывание закончится, вы вернётесь к полю в том же виде, в каком его оставили, и продолжите с того числа, на котором остановились. Запоминать место — часть задания.",
          "Отвечайте как можно быстрее, но не в ущерб точности. Прерываний будет тем больше, чем дальше; сбиться после возврата — обычное дело, просто продолжайте.",
          "Сорок минут без перерыва. Во время блока не разговаривайте и не меняйте посадку. Если случится что-то серьёзное — руку вверх, мы остановим."
        ],
        "footer": "Оператор начнёт, когда вы будете готовы."
      }
    },
    {
      "id": "baseline-post",
      "games": [
        "org.reconnect.baseline"
      ],
      "end": {
        "by": "time",
        "ms": 600000
      },
      "interstitial": {
        "title": "Покой, 10 минут",
        "body": [
          "Задания закончились, дальше ничего решать не нужно. Снова крестик в центре: смотрите на него и сидите спокойно.",
          "Эта часть нужна ровно затем, чтобы увидеть, как вы восстанавливаетесь после нагрузки, поэтому она такая же важная, как и остальные, — даже если делать в ней нечего.",
          "Постарайтесь не засыпать и, если получится, не прокручивать в голове только что пройденные задания."
        ],
        "footer": "Оператор начнёт, когда вы будете готовы."
      },
      "overrides": {
        "org.reconnect.baseline": {
          "durationMs": 600000,
          "showTimer": false,
          "text": "Эксперимент закончен. Посидите спокойно, смотрите в центр экрана."
        }
      }
    }
  ],
  "interstitials": {
    "intro": {
      "title": "Что будет дальше",
      "body": [
        "Сессия займёт около двух часов и состоит из пяти частей: покой, обучение, два блока заданий и снова покой. Перед каждой частью будет такой же экран с описанием.",
        "Отвечать нужно тремя клавишами — Q, W, E. Правая рука лежит на них всё время, смотреть на клавиатуру не понадобится: подсказка всегда есть на экране.",
        "Главное на всю сессию: сидите свободно, но не двигайте головой, не сжимайте зубы и не разговаривайте во время заданий. Шапку с датчиками не поправляйте сами — если она давит или что-то мешает, скажите, мы поправим.",
        "Вопросы удобнее задавать на таких экранах, между частями. Сейчас — самое время."
      ],
      "footer": "Оператор начнёт, когда вы будете готовы."
    },
    "outro": {
      "title": "Готово",
      "body": [
        "Сессия закончена, спасибо. Посидите спокойно, пока мы снимаем шапку, — резко вставать не стоит.",
        "Если хотите рассказать, где было тяжелее всего или что мешало, — сейчас самое полезное время: это помогает нам понять запись."
      ]
    }
  }
}
